PACK	INSTANCES
chainsing	chainsing-1000-1, chainsing-1000-2, chainsing-1000-3, chainsing-10000-1, chainsing-10000-2, chainsing-10000-3, chainsing-50000-1, chainsing-50000-2, chainsing-50000-3
filterdesign	2013_dsNRL, 2013_wbNRL, 2013i_wbNRL, 2013_firL1, 2013_firL1Linfalph, 2013_firL1Linfeps, 2013_firL2a, 2013_firL2L1alph, 2013_firL2L1eps, 2013_firL2Linfalph, 2013_firL2Linfeps, 2013_firLinf
nb	nb, nb_L1, nb_L2, nb_L2_bessel
sched	sched_50_50_orig, sched_50_50_scaled, sched_100_50_orig, sched_100_50_scaled, sched_100_100_orig, sched_100_100_scaled, sched_200_100_orig, sched_200_100_scaled
strain	nql30, nql60, nql90, nql180, qssp30, qssp60, qssp90, qssp180
